scene_id,start_time,end_time,description
1,00:00:00.000,00:00:14.560,"This video is a cinematic opening sequence, likely for a Turkish film or production, featuring a series of logos and credits against a dark background.

The sequence can be broken down into three main parts:

1.  **The ""ZEMBEREK"" Logo Reveal (Images 1-8):**
    *   The sequence begins with a black screen.
    *   It then transitions into a dynamic, cosmic animation where streams of golden, white, and green particles converge towards the center.
    *   These particles coalesce to form the stylized logo for ""ZEMBEREK,"" which consists of the word ""ZEMBEREK"" in a white, serif font, positioned in front of a glowing, concentric circular emblem that resembles a stylized eye or target. The logo is illuminated with a warm, orange and yellow glow.
    *   The animation concludes with the logo centered on the screen, with subtle particle effects continuing in the background, before fading to black.

2.  **The Turkish Ministry of Culture and Tourism Logo (Images 9-21):**
    *   After a black screen, a circular, red logo appears.
    *   This is the official seal of the ""Türkiye Cumhuriyeti Kültür ve Turizm Bakanlığı"" (Ministry of Culture and Tourism of the Republic of Turkey).
    *   The logo features a central knot-like symbol surrounded by stars and the ministry's name in a circular arrangement.
    *   The logo is animated with a subtle, rotating effect and a glowing outline.
    *   Below the logo, the text ""T.C. Kültür ve Turizm Bakanlığı tarafından desteklenmiştir"" (Supported by the Ministry of Culture and Tourism of the Republic of Turkey) appears in a smaller font.
    *   The logo and text remain on screen for several seconds before fading out.

3.  **The TRT Sinema Logo (Images 22-26):**
    *   The screen turns black again.
    *   The logo for ""TRT SINEMA"" appears. It features the text ""TRT"" above ""SINEMA,"" with a film clapperboard icon above the text.
    *   Below the main logo, the text ""TRT Ortaklığıyla/ In Coproduction with"" is displayed, indicating a co-production partnership.
    *   The logo is initially gray, then brightens to white, and then fades back to gray before the screen goes black.

The overall style is professional and cinematic, designed to establish the production's identity and its official backing. The use of a cosmic reveal for the main logo, followed by government and broadcaster logos, is a common format for film credits."
2,00:00:14.600,00:00:24.240,"This video presents a continuous, over-the-shoulder shot from the back seat of a moving car, capturing a journey through a rural landscape. The perspective remains fixed, offering a consistent view of the road ahead, the car's interior, and the two occupants.

**Key Elements:**

*   **Setting:** The car is traveling along a long, straight, paved road that cuts through vast, open fields under a bright, partly cloudy sky. The scenery is rural and expansive, with dry grass, sparse trees, and distant wind turbines visible on the horizon.
*   **Occupants:**
    *   **Driver (Left):** A man with short hair, wearing a light-colored shirt. He is focused on driving, holding the steering wheel with both hands. He occasionally glances at the passenger or the road ahead. He wears a red bracelet on his left wrist.
    *   **Passenger (Right):** A man with dark hair and a beard, wearing a dark jacket and white wireless earbuds. He is mostly looking forward or at the driver, appearing relaxed and engaged in conversation or simply enjoying the ride.
*   **Car Interior:** The dashboard features a modern infotainment screen displaying what appears to be a music player interface. The rearview mirror reflects the driver's face, adding a layer of depth to the scene.
*   **Action:** The primary action is the car's forward motion. The passenger interacts with the car's system, reaching out to touch or tap the infotainment screen at several points. The driver maintains control of the vehicle, with his hands on the wheel. The scenery outside the windows flows past, indicating steady movement.

**Overall Impression:**
The video captures a calm, everyday moment of travel. The combination of the steady forward motion, the open rural landscape, and the quiet interaction between the two men creates a sense of peacefulness and routine. The focus on the driver's reflection in the rearview mirror adds a subtle, introspective quality to the scene."
3,00:00:24.280,00:00:28.560,"This video clip presents a slow, contemplative scene from the perspective of a passenger in a car.

The central subject is a middle-aged man with a balding head and a full, grey beard. He is dressed formally in a dark suit and a white collared shirt. He is seated in the back of a car, looking out the window with a pensive, thoughtful expression.

The car is moving forward, and the scenery outside the window changes gradually. Initially, a large, white wind turbine is visible against a bright blue sky with scattered white clouds. The landscape is a vast, open field of dry, golden-brown grass. As the car moves, the turbine appears to drift past, and other elements come into view, including a distant, skeletal metal structure and a few scattered trees.

The camera remains steady, focused on the man's profile, capturing his quiet observation of the passing landscape. The overall mood is one of quiet introspection, suggesting the man is lost in thought or perhaps reflecting on his journey. The contrast between the man's formal attire and the rustic, natural environment outside adds a layer of narrative intrigue."
4,00:00:28.600,00:00:31.120,"This video presents a continuous, cinematic shot from the perspective of a passenger in the back seat of a car, looking forward at the driver and the road ahead.

**Scene Description:**

*   **Setting:** The car is driving along a long, straight, and somewhat weathered asphalt road that cuts through a vast, open, rural landscape. The terrain is flat and covered in dry, golden-brown grass and fields under a bright, partly cloudy sky. In the distance, a wind turbine is visible on the horizon, adding a modern element to the otherwise natural scenery.
*   **Characters:** There are two men in the front seats.
    *   The **driver**, on the left, is a man with short dark hair, wearing a light-colored, possibly white, collared shirt. His hands are on the steering wheel, and he is looking straight ahead, focused on the road. A red string bracelet is visible on his right wrist.
    *   The **passenger**, on the right, is seen from the back. He has short dark hair and is wearing a dark-colored shirt.
*   **Interior Details:** The car's interior is modern. A large, central touchscreen display is visible on the dashboard, showing what appears to be a navigation or media interface. The rearview mirror is positioned centrally above the dashboard, and it reflects the driver's face, showing him looking intently forward.
*   **Mood and Atmosphere:** The scene conveys a sense of calm, quiet travel. The open road and expansive landscape evoke feelings of freedom, solitude, or contemplation. The steady, forward motion of the car suggests a journey, and the focused expression of the driver implies purpose or determination. The overall aesthetic is clean and cinematic, with a slightly desaturated color palette that enhances the sense of a long, quiet drive.

The video is a single, unbroken shot, capturing the journey from the passenger's perspective."
5,00:00:31.160,00:00:33.680,"This video clip presents a serene and contemplative scene from the perspective of a passenger in a moving car.

**Subject and Setting:**
The central focus is a man with a gray beard and receding hairline, dressed in a formal black suit and white collared shirt. He is seated in the back of a luxury vehicle, likely a sedan, with light beige or tan leather interior. He is shown in profile, looking out the passenger-side window with a calm, pensive expression.

**The Journey:**
The car is in motion, traveling through a vast, open landscape. The scenery outside is a dry, golden-brown field or plain under a bright blue sky dotted with fluffy white clouds. The motion blur of the passing landscape outside the window emphasizes the car's movement and adds a sense of journey and transition.

**Visual Style and Mood:**
The video has a cinematic quality, with soft, natural lighting and a slightly desaturated color palette that enhances the contemplative mood. The composition is stable, focusing on the man's quiet observation of the world passing by. The overall atmosphere is one of solitude, introspection, and peaceful travel. The first frame is slightly more distinct, showing a distant object, perhaps a sign or pole, while the subsequent frames show the blur of the natural landscape.

In essence, the video captures a quiet, reflective moment of a man on a journey, observing the world from the comfort of his car."
6,00:00:33.720,00:00:42.880,"This video sequence captures a tense and suspenseful moment from the perspective of a passenger in a car, filmed from the back seat. The scene unfolds as the car drives along a rural, two-lane road through a dry, sunlit landscape.

The narrative begins with a calm, almost mundane drive. The driver, a man in a light-colored shirt, is focused on the road ahead. In the rearview mirror, his reflection is visible, showing a neutral or slightly concerned expression. The passenger, a man with dark hair and a beard wearing white earbuds, sits quietly beside him, looking forward.

As the car progresses, the road ahead becomes more defined by its surroundings: golden, dry grass fields on either side, and a clear blue sky with scattered clouds. In the distance, several wind turbines are visible, adding to the rural, open setting.

The tension escalates as the car approaches a roadblock. A temporary barrier with red and white chevrons appears in the middle of the road, accompanied by traffic signs. The driver slows down, his expression becoming more serious and focused as he prepares to stop or navigate around the obstruction. The passenger turns his head to look at the driver, and their faces are now clearly visible in profile. The driver's expression is one of concentration, perhaps mixed with apprehension, as he assesses the situation.

The final frames capture a moment of intense focus between the two men. The driver is looking ahead, his hands gripping the wheel, while the passenger is looking at him, their expressions conveying a shared sense of urgency or concern. The rearview mirror continues to show the driver's face, his gaze fixed on the road ahead, emphasizing his determination to proceed.

Overall, the video creates a palpable sense of suspense and anticipation, using the simple act of driving through a rural landscape to build a narrative of impending action or decision. The camera's fixed position from the back seat immerses the viewer in the experience, making them feel as if they are part of the unfolding drama."
7,00:00:42.920,00:00:47.960,"This video is a minimalist, animated logo reveal for the brand ""KILAVUZ"".

The sequence begins with a black screen. A white, stylized arrow icon, resembling a play button or a forward-pointing chevron, animates into the center of the screen. The word ""KILAVUZ"" then types out letter by letter to the left of the arrow. The final logo consists of the text ""KILAVUZ"" in a bold, white, sans-serif font, followed by the arrow icon. The arrow icon then slides off-screen to the right, leaving the text ""KILAVUZ"" centered alone on the black background. The video concludes with this static logo on screen.

The design is clean and modern, using a stark black-and-white color scheme to create a strong visual impact. The animation is smooth and deliberate, building the brand identity step by step."
8,00:00:48.000,00:00:53.240,"This video presents a serene and contemplative scene of a lone individual walking across a vast, rural landscape.

**Visual Description:**
The setting is a wide, open field of dry, golden-brown grass, likely a harvested field, which stretches across the frame. The terrain is gently rolling, with a distinct ridge or hill rising towards the center-right of the image. A clear, deep blue sky dominates the upper portion of the frame, dotted with scattered, fluffy white clouds. The overall color palette is warm and earthy, with the browns and tans of the field contrasting beautifully against the cool blue of the sky.

**Key Element:**
The most prominent subject is a single, small human figure, seen from a distance, walking up the ridge. The person is moving away from the viewer, following a faint, winding path that cuts through the field. Their small size relative to the expansive landscape emphasizes a sense of solitude and the vastness of nature.

**Mood and Atmosphere:**
The video evokes a feeling of peace, introspection, and quiet determination. The slow, steady movement of the person suggests a journey, both physical and metaphorical. The open sky and uncluttered horizon contribute to a sense of freedom and possibility. The scene is tranquil and meditative, inviting the viewer to reflect on themes of solitude, perseverance, and the beauty of the natural world.

In summary, the video captures a moment of quiet solitude as a person walks across a beautiful, open field under a vast, cloud-dotted sky, creating a powerful and peaceful visual narrative."
9,00:00:53.280,00:00:59.040,"This video clip presents a dynamic and visually striking scene of a man running across a vast, harvested field.

**Setting and Atmosphere:**
The environment is a large, rolling hill covered in golden-brown stubble, likely after a wheat harvest. The field is marked with distinct, curved lines from the harvesting machinery, creating a textured, almost abstract pattern across the landscape. The sky above is a clear, bright blue, suggesting a sunny day. The overall atmosphere is one of openness and isolation, with the man being the sole figure in the expansive, rural setting.

**The Subject:**
The central figure is a man dressed in formal business attire, which creates a stark contrast with the rustic, natural environment. He is wearing a dark suit jacket, a light blue collared shirt, and dark trousers, with suspenders visible over his shirt. He is running towards the camera with a determined and urgent expression on his face. His posture is forward-leaning, and his arms are pumping as he runs, conveying a sense of speed and purpose.

**Action and Narrative:**
The video captures the man in motion, moving from the background towards the foreground. The camera appears to be stationary, allowing the man to approach and fill more of the frame as he runs. The sequence progresses from him being a small figure in the distance to becoming the dominant subject, and finally, as he gets very close, he begins to blur slightly, indicating the speed of his movement. His focused expression and the act of running suggest he is either fleeing from something or rushing towards a destination, creating a sense of narrative tension.

**Visual Style:**
The video is shot in a cinematic style, with a wide-angle perspective that emphasizes the scale of the landscape. The composition uses the natural lines of the field to lead the viewer's eye towards the man. The color palette is dominated by earthy tones of gold and brown, contrasted with the man's dark suit and the blue sky, which makes him stand out.

In summary, the video is a compelling visual metaphor, juxtaposing the formal, urban world of the businessman with the raw, natural world, suggesting a theme of escape, pursuit, or a significant life transition."
10,00:00:59.080,00:01:39.600,"The video begins with a serene, wide shot of a rural landscape under a vast, clear blue sky. A paved road winds through the scene, flanked by golden fields of what appears to be wheat or barley, and patches of green crops, possibly sunflowers, in the foreground. The camera pans slowly to the left, revealing the expansive, rolling terrain.

As the camera continues its pan, several wind turbines come into view in the distance, standing tall against the horizon. The scene remains tranquil and open, emphasizing the quiet beauty of the countryside.

Suddenly, the peacefulness is interrupted as a black sedan pulls over to the side of the road. A man in a white shirt and dark pants exits the vehicle and crouches down near the front wheel, appearing to inspect something on the ground or the car.

Shortly after, two men in dark suits emerge from the car. One of them, who is bald, begins talking on a cell phone while the other stands beside him, looking around. The man in the suit appears to be in a position of authority or responsibility, possibly a bodyguard or security personnel.

A second car, a silver sedan, pulls up next to the black sedan. A photographer, dressed casually, steps out of the silver car and begins taking pictures of the scene. The photographer is focused on capturing the moment, moving around the cars to get the best angles.

The men in suits continue their conversation, with the bald man on the phone and the other man standing nearby. The photographer continues to take pictures, documenting the scene.

The video concludes with the men in suits still engaged in their conversation, the photographer still taking pictures, and the two cars parked side by side on the side of the road. The wind turbines continue to spin in the background, and the vast, open landscape remains a constant backdrop to the unfolding scene.

Overall, the video captures a moment of quiet tension in an otherwise peaceful rural setting, with the presence of the men in suits and the photographer suggesting a planned event or a significant incident that has occurred. The contrast between the serene landscape and the focused activity of the individuals creates a sense of intrigue and anticipation."
11,00:01:39.640,00:02:15.240,"This video captures a sequence of events unfolding on a rural road next to a vast field of sunflowers under a clear, bright sky.

The central figure is a bald man with a grey beard, dressed in a formal black suit, white shirt, and tie. He is initially seen walking along the roadside, engaged in a phone conversation while looking down thoughtfully. He is accompanied by a second man, also in a suit, who walks behind him.

As the scene progresses, a third person, a photographer wearing a tan vest and holding a DSLR camera, enters the frame from the left. The photographer begins taking pictures of the main subject, who has now stopped walking and is standing near the rear of a parked grey sedan. The car's license plate is visible and reads ""91 KHT 624"".

The main subject ends his phone call, puts the phone away, and begins to interact with the photographer. He appears to be reviewing photos or discussing the shots, leaning in to look at the camera's screen. The second man in the suit stands nearby, observing the interaction.

The overall atmosphere suggests a photoshoot or a planned meeting, with the man in the suit possibly being the subject being photographed or a bodyguard, and the photographer capturing the moment. The setting provides a stark, picturesque contrast to the formal attire of the subjects."
12,00:02:15.280,00:02:20.840,"This video clip presents a static, wide-angle shot of a rural roadside scene under a clear, bright blue sky, suggesting it was filmed during the golden hour. The composition is layered, with the foreground, midground, and background each contributing to a sense of depth and atmosphere.

**Key Elements:**

*   **Foreground:** A man in a white shirt and dark trousers is crouched down on the grassy verge next to the road, looking towards the camera. His posture suggests he is either inspecting something on the ground or posing for the shot.
*   **Midground:** Two cars are parked on the side of the asphalt road. The car in the foreground is a sleek, black BMW sedan, identifiable by its iconic kidney grille and modern headlights. Its license plate reads ""91 MLN 513"". Behind it is a silver or grey sedan. Several men in dark suits are standing near the silver car, appearing to be in conversation or observing the scene.
*   **Background:** The landscape is dominated by rolling, sun-drenched hills. These hills are a mix of cultivated fields and what appear to be vineyards, characterized by their neat rows. Several wind turbines are visible on the distant ridges, adding a modern, industrial element to the otherwise pastoral setting.

**Overall Impression:**

The scene has a cinematic quality, with warm, natural lighting that casts long, soft shadows. The combination of the formal attire of the men, the luxury vehicles, and the expansive, serene landscape creates a narrative that is open to interpretation. It could be a staged photoshoot, a scene from a film, or a moment captured during a business trip or private gathering in a scenic location. The stillness of the image, despite the presence of people, gives it a contemplative and slightly dramatic mood."
13,00:02:20.880,00:02:31.880,"This video clip presents a cinematic, slow-motion scene set on a long, straight road in a vast, rural landscape under a clear blue sky. The overall mood is one of quiet tension and isolation.

The scene features three men and a car:

*   **The Man Walking Away:** On the left side of the frame, a man in a sharp, dark suit is seen from behind, walking away from the camera down the center of the road. His steady, purposeful gait suggests he is leaving the scene or heading towards an unknown destination. He is the only person moving away from the camera, creating a sense of departure or finality.
*   **The Two Men by the Car:** On the right side, near the rear of a dark grey sedan, two men are engaged in a focused interaction.
    *   One man, with dark curly hair and a beard, is dressed in a casual, light-colored shirt and a vest. He is holding a DSLR camera and appears to be showing something on its screen to the other man.
    *   The second man is older, bald with a white beard, and wears a dark suit and tie. He is leaning against the car, looking intently at the camera screen, and gesturing with his free hand as if giving instructions or discussing the shot. His expression is serious and concentrated.

The environment is stark and beautiful: the road stretches into the distance, flanked by golden, dry fields and a patch of green crops on the right. The bright, low-angle sunlight casts long, dramatic shadows across the road, enhancing the cinematic quality.

The sequence of images shows the man in the suit walking further down the road, while the two men by the car remain in their interaction, their focus unwavering. The camera appears to be slowly zooming in or the subjects are moving slightly closer, bringing the two men at the car into sharper focus as the man in the suit recedes into the distance. The overall narrative suggests a moment of pause or confrontation, perhaps a photographer and his subject, or a film crew, while a third party walks away, leaving them to their work."
14,00:02:31.920,00:02:41.920,"This video clip presents a tense, cinematic scene set on a rural road under a clear, sunny sky.

**Setting:**
The scene is located on a two-lane asphalt road that cuts through a vast, sun-drenched countryside. The background features rolling hills with terraced fields, likely vineyards, and several wind turbines are visible on the distant ridges, suggesting a modern, rural landscape.

**Characters and Actions:**
There are four men in the scene, all dressed in dark suits, which contrasts with the bright, natural setting.
- **Man 1 (Driver):** A man in a suit is standing beside the front passenger door of a black BMW sedan. He opens the door and appears to be getting into the car. He then looks inside, as if checking something or someone.
- **Man 2 (Crouching Man):** Another man, also in a suit, is crouched down beside the front passenger wheel of the same black BMW. He is looking up towards the car or the other men, and his posture suggests he might be inspecting something on the ground or preparing to move.
- **Man 3 and 4 (Background):** Two other men in suits are standing near a second, silver sedan parked behind the BMW. They appear to be observing the situation or waiting.

**Key Details:**
- The black BMW has a visible license plate that reads ""91 MLN 513"".
- The lighting is warm and golden, indicative of late afternoon or early evening sun, casting long shadows and creating a dramatic, almost film noir atmosphere.
- The overall mood is suspenseful and mysterious, as the characters' actions—getting into a car, crouching, and observing—suggest a planned event or an ambush. The setting and attire hint at a high-stakes situation, possibly involving a heist, an escape, or a clandestine meeting.

In summary, the video depicts a group of men in suits engaged in a secretive or urgent activity on a rural road, with a strong emphasis on atmosphere and tension."
