scene_id,start_time,end_time,description
27,00:06:35.320,00:08:14.680,"The video presents a narrative set in a vast, sun-drenched rural landscape, characterized by golden fields, a clear blue sky with scattered clouds, and a distant line of wind turbines. The story unfolds in a series of scenes that transition from a group interaction to a more intimate, focused moment between two individuals, and finally to a broader, more solitary scene.

The video begins with a wide shot of a rural road flanked by golden fields under a bright blue sky. Two cars are parked on the side of the road, and a group of people, dressed in business attire, are gathered around them. The individuals appear to be engaged in a discussion or meeting, with some standing near the cars and others conversing. The presence of wind turbines in the background suggests a modern, possibly eco-conscious setting, contrasting with the traditional agricultural landscape.

As the video progresses, the focus narrows to two men in suits standing near the parked cars. One man, who appears to be younger, leans against the rear of a car, while the other, an older man with a beard, stands nearby. The younger man seems to be waiting or observing, while the older man walks away from the cars, possibly heading towards the field. The scene captures a moment of transition or contemplation, as the older man moves away from the group, leaving the younger man behind.

The narrative then shifts to a more intimate and focused interaction between the two men. The older man, now standing in the field, is seen holding something small in his hand, possibly a seed or a piece of grain. He appears to be examining it closely, while the younger man stands beside him, observing with interest. The older man’s actions suggest a moment of reflection or contemplation, perhaps related to the agricultural setting or the broader context of their meeting. The younger man’s attentive posture indicates a shared curiosity or a moment of learning.

The final scene of the video captures a broader, more solitary moment. The older man, still holding the small object, turns to face the younger man, who is now standing a short distance away. The younger man’s expression is one of curiosity and engagement, as he watches the older man’s actions. The scene is set against the backdrop of the expansive field and the distant wind turbines, emphasizing the vastness of the landscape and the significance of the moment.

Overall, the video portrays a narrative that transitions from a group interaction to a more personal and reflective moment between two individuals. The setting, with its golden fields and wind turbines, provides a backdrop that suggests themes of nature, industry, and perhaps a connection between the past and the future. The characters’ actions and interactions hint at a deeper story, possibly involving a discussion about agriculture, sustainability, or a personal reflection on the changing world around them. The video ends with a sense of contemplation and connection, as the two men stand together in the field, surrounded by the beauty of the rural landscape."
28,00:08:14.720,00:08:41.560,"The video presents a cinematic and emotionally resonant scene set in a vast, rural landscape.

**Setting and Atmosphere:**
The scene is established in a wide, open field under a cloudy, overcast sky. The terrain is a patchwork of golden-brown harvested fields and patches of green, rolling hills that stretch into the distance. A dirt path cuts through the foreground, leading the viewer's eye into the expansive scenery. The overall mood is contemplative and slightly melancholic, enhanced by the muted, natural color palette and the solitary figure.

**Main Character and Initial Action:**
The primary subject is an elderly man with a grey beard, wearing a dark flat cap, a plaid shirt, and a dark vest. He is seen walking slowly and deliberately along the dirt path, his gaze directed downward. His posture and pace suggest a sense of weariness, introspection, or perhaps a journey that is both physical and emotional. The camera follows him as he moves, creating a sense of personal narrative and solitude.

**Introduction of New Characters:**
As the elderly man continues walking, two other men enter the scene from the right side of the frame. The first is a younger man in a light blue shirt and dark trousers, wearing suspenders. He approaches the elderly man with an animated, almost joyful expression, suggesting a friendly or familiar relationship. The second man, who appears to be a photographer, follows behind him, carrying a camera and wearing a vest over an orange shirt. He seems to be documenting the encounter.

**Interaction and Climax:**
The interaction between the three men is the focal point of the scene. The younger man in the blue shirt engages the elderly man in conversation, his body language and facial expressions conveying warmth and excitement. The photographer, meanwhile, stops to take pictures, capturing the moment. At one point, the elderly man reaches out and gently touches the photographer's camera, perhaps to adjust it or to share a moment of connection. This gesture adds a layer of intimacy and shared experience to the scene.

**Conclusion:**
The video concludes with the three men standing together, engaged in conversation. The elderly man, the younger man, and the photographer appear to be sharing a meaningful moment in the open field. The interaction suggests a narrative of connection, perhaps a reunion or a shared purpose, set against the backdrop of the vast, serene landscape. The overall tone is one of quiet humanity and the beauty of simple, authentic moments.

In summary, the video tells a story of solitude, connection, and the power of human interaction, set in a breathtaking rural environment. The characters' actions and expressions convey a range of emotions, from contemplation to joy, creating a rich and evocative visual narrative."
29,00:08:41.600,00:08:57.120,"The video clip portrays a poignant and emotionally charged interaction between three men in a vast, open, and arid landscape under a bright, partly cloudy sky.

The scene centers on an older man with a full grey beard and a dark flat cap. He is dressed in a blue and white plaid shirt, a dark vest, and dark trousers, with keys hanging from his belt. He is the primary speaker and appears to be conveying a message of deep emotion, passion, or urgency. His expressions shift from a warm, almost joyful smile to intense seriousness, and he uses expressive hand gestures, including placing his hand on the shoulder of the man facing him.

The second man, seen mostly from behind, wears a light blue shirt and black suspenders. He stands facing the older man, listening intently, suggesting he is the primary recipient of the older man's message. His posture is receptive, and he remains still throughout the interaction, absorbing what is being said.

The third man, with dark curly hair and glasses, wears a tan vest over a light-colored shirt. He is initially present on the right side of the frame, observing the interaction. He then moves out of the frame to the left, leaving the older man and the man in the blue shirt as the sole focus of the conversation.

The sequence culminates in a moment of profound connection: the older man reaches out and places his hand firmly on the shoulder of the man in the blue shirt. This gesture, combined with his earnest facial expressions, suggests a moment of reconciliation, a heartfelt farewell, or a significant revelation. The emotional weight of the scene is heightened by the stark, empty background, which isolates the characters and emphasizes the intimacy and importance of their exchange.

The video concludes with a deliberate shift in focus, blurring the figures and drawing attention to the expansive, desolate landscape, leaving the viewer with a sense of the vastness of the world and the fleeting, yet deeply significant, nature of human connection."
30,00:08:57.160,00:09:24.360,"The video is a cinematic and emotionally resonant piece that unfolds in two distinct, yet thematically connected, settings.

**First Scene: The Walk Through the Golden Fields**

The video opens with a powerful and intimate scene. Two men are seen walking along a dirt path through a vast, golden field under an overcast sky. The camera follows them from behind, emphasizing their journey and the expansive, serene landscape around them.

- **The Men and Their Interaction**: The man on the left, older and wearing a dark vest over a plaid shirt and a beret, has his arm around the shoulder of the younger man on the right, who is dressed in a light blue shirt and dark trousers with suspenders. Their physical closeness and the supportive gesture of the arm around the shoulder suggest a deep bond, perhaps that of a father and son, close friends, or a mentor and protégé. The younger man occasionally turns his head to look at the older man, reinforcing the sense of connection and shared experience.

- **The Setting and Atmosphere**: The landscape is characterized by rolling hills and fields of dry, golden grass, creating a sense of openness and tranquility. The sky is filled with soft, grey clouds, which adds a contemplative and slightly melancholic mood to the scene. The path they walk on winds gently through the terrain, and the distant horizon is dotted with a few trees and shrubs, adding depth to the composition.

- **The Journey**: As they walk, the camera subtly shifts its perspective, sometimes showing them from a side angle, which allows the viewer to see their expressions and the subtle interactions between them. The overall mood is one of quiet companionship, reflection, and shared purpose. The scene evokes a sense of nostalgia, adventure, and the enduring strength of human connection.

**Second Scene: The Photographer in the Sunflower Field**

The video transitions to a completely different setting, introducing a new character and a new atmosphere.

- **The New Setting**: The scene shifts to a vibrant sunflower field under a bright blue sky with fluffy white clouds. In the distance, several wind turbines stand tall against the horizon, adding a modern, almost industrial contrast to the natural beauty of the field. The sunflowers are in full bloom, creating a sea of yellow and green that stretches as far as the eye can see.

- **The Photographer**: A man with a beard, wearing a light-colored shirt and a vest, enters the frame. He is holding a camera and appears to be a photographer, carefully navigating through the sunflowers. His movements are deliberate and focused, suggesting he is searching for the perfect shot. He stops at various points, crouching down to get a closer view of the flowers, and then stands up to capture the wider landscape.

- **The Mood and Theme**: This scene is bright, cheerful, and full of life. The contrast between the overcast, contemplative mood of the first scene and the sunny, vibrant atmosphere of the second creates a sense of transition and change. The photographer’s actions suggest a sense of exploration and appreciation for the beauty of nature. The wind turbines in the background hint at the intersection of nature and technology, adding a layer of modernity to the otherwise pastoral setting.

**Overall Impression**

The video tells a story of two different journeys: one of companionship and reflection, and another of exploration and discovery. The transition between the two scenes is smooth and deliberate, creating a narrative that is both visually stunning and emotionally engaging. The first scene evokes a sense of nostalgia and connection, while the second scene brings a sense of optimism and wonder. Together, they create a powerful and memorable visual experience that celebrates the beauty of human relationships and the natural world."
31,00:09:24.400,00:10:00.560,"This video presents a cinematic and suspenseful narrative unfolding inside a car and then transitioning to an outdoor scene.

The story begins with a close-up shot from inside a car, initially focusing on the blurred interior. The camera slowly pans right, revealing a man in a white shirt sleeping peacefully in the passenger seat. His head is resting against the headrest, and his mouth is slightly open, indicating deep sleep. The camera then pans further to the right, revealing another man in the back seat, dressed in a suit and tie, who appears to be in distress. He is crying and has a worried expression on his face. The camera then pans back to the front, showing the driver, who is also asleep. The camera then pans to the right again, showing the car's side mirror. In the mirror, we can see three men walking towards the car. The man in the middle is wearing a blue shirt and suspenders, while the man on the right is wearing a vest and a cap. The man on the left is wearing a suit and sunglasses. The camera then pans back to the front, showing the driver and the passenger again. The driver is still asleep, and the passenger is still crying. The camera then pans to the right again, showing the side mirror. In the mirror, we can see the three men walking towards the car. The man in the middle is still wearing a blue shirt and suspenders, while the man on the right is still wearing a vest and a cap. The man on the left is still wearing a suit and sunglasses. The camera then pans back to the front, showing the driver and the passenger again. The driver is still asleep, and the passenger is still crying. The camera then pans to the right again, showing the side mirror. In the mirror, we can see the three men walking towards the car. The man in the middle is still wearing a blue shirt and suspenders, while the man on the right is still wearing a vest and a cap. The man on the left is still wearing a suit and sunglasses. The camera then pans back to the front, showing the driver and the passenger again. The driver is still asleep, and the passenger is still crying. The camera then pans to the right again, showing the side mirror. In the mirror, we can see the three men walking towards the car. The man in the middle is still wearing a blue shirt and suspenders, while the man on the right is still wearing a vest and a cap. The man on the left is still wearing a suit and sunglasses. The camera then pans back to the front, showing the driver and the passenger again. The driver is still asleep, and the passenger is still crying. The camera then pans to the right again, showing the side mirror. In the mirror, we can see the three men walking towards the car. The man in the middle is still wearing a blue shirt and suspenders, while the man on the right is still wearing a vest and a cap. The man on the left is still wearing a suit and sunglasses. The camera then pans back to the front, showing the driver and the passenger again. The driver is still asleep, and the passenger is still crying. The camera then pans to the right again, showing the side mirror. In the mirror, we can see the three men walking towards the car. The man in the middle is still wearing a blue shirt and suspenders, while the man on the right is still wearing a vest and a cap. The man on the left is still wearing a suit and sunglasses. The camera then pans back to the front, showing the driver and the passenger again. The driver is still asleep, and the passenger is still crying. The camera then pans to the right again, showing the side mirror. In the mirror, we can see the three men walking towards the car. The man in the middle is still wearing a blue shirt and suspenders, while the man on the right is still wearing a vest and a cap. The man on the left is still wearing a suit and sunglasses. The camera then pans back to the front, showing the driver and the passenger again. The driver is still asleep, and the passenger is still crying. The camera then pans to the right again, showing the side mirror. In the mirror, we can see the three men walking towards the car. The man in the middle is still wearing a blue shirt and suspenders, while the man on the right is still wearing a vest and a cap. The man on the left is still wearing a suit and sunglasses. The camera then pans back to the front, showing the driver and the passenger again. The driver is still asleep, and the passenger is still crying. The camera then pans to the right again, showing the side mirror. In the mirror, we can see the three men walking towards the car. The man in the middle is still wearing a blue shirt and suspenders, while the man on the right is still wearing a vest and a cap. The man on the left is still wearing a"
32,00:10:00.600,00:10:45.840,"This video clip portrays a tense and emotionally charged confrontation between three men on a deserted roadside under a clear, bright sky.

The central figure is an older man with a full white beard and a black flat cap, dressed in a plaid shirt and dark vest. He is animated, gesturing emphatically with his hands and speaking passionately, his expressions shifting from anger to frustration and then to a more pleading or desperate tone. His body language suggests he is trying to make a strong point or explain something urgent.

He is facing two men in suits. The man on the left, who is partially seen from behind, has gray hair and a beard. He appears to be listening intently, and at one point, he reaches out and places a hand on the older man's shoulder, perhaps in an attempt to calm him down or to assert authority. The man in the middle, wearing a light blue shirt and suspenders, watches the interaction with a serious, concerned, and slightly apprehensive expression. His demeanor suggests he is caught in the middle of a difficult situation.

The setting is stark and isolating—a paved road cutting through dry, golden fields under a vast, empty sky. This barren landscape emphasizes the intensity of the interaction, suggesting the confrontation is both personal and significant, taking place in a remote location where there is no escape.

The sequence of events shows the older man initially trying to reason with the two men, but as the conversation progresses, his frustration mounts. He eventually turns away, walking down the road, seemingly defeated or unwilling to continue the argument. The two men in suits then follow him, their posture suggesting they are escorting or pursuing him. The video ends with a shot from behind the man in the suit, looking down the road where the older man has disappeared, leaving a sense of unresolved tension and a looming sense of consequence.

Overall, the video captures a dramatic moment of conflict, possibly a negotiation gone wrong, a confrontation with the law, or a moment of personal reckoning, all set against a desolate backdrop that amplifies the emotional weight of the scene."
33,00:10:45.880,00:11:35.960,"This video presents a narrative set in a desolate, open landscape, likely a field or plain, under a clear blue sky with wind turbines visible in the distance. The story unfolds through a series of interactions inside a car.

The sequence begins with a man with a long, grey beard and a dark flat cap sitting in the passenger seat of a car. He is smiling and appears to be in a good mood, looking out the window at the scenery.

Shortly after, a second man, bald with a grey beard and wearing a dark suit, enters the car from the driver's side. He settles into the driver's seat, and the two men appear to be having a conversation. The passenger continues to smile, suggesting a relaxed or pleasant interaction.

The mood shifts as a third man, dressed in a light blue shirt and dark suspenders, approaches the car from outside. He leans in through the open window and begins speaking to the man in the suit. The man in the suit listens intently, then gestures with his hand, seemingly in response to the third man's words. Their conversation appears serious and focused.

The third man then steps back, and the man in the suit turns his attention to the passenger, who is still smiling. The man in the suit continues to speak, possibly explaining something to the passenger.

The scene then cuts to a shot of the third man standing alone in the field, looking off into the distance. He appears contemplative or perhaps frustrated, as his expression is serious and his gaze is directed away from the car.

The video concludes with a final shot of the man in the light blue shirt, emphasizing his isolation in the vast, open landscape. The presence of the wind turbines in the background adds a sense of modernity or industrial development to the otherwise rural setting.

Overall, the video portrays a moment of interaction and conversation between three men in a car, followed by a moment of solitude for one of them, set against a backdrop of a vast, open field with wind turbines. The mood shifts from relaxed to serious, and the final shot leaves the viewer with a sense of unresolved tension or contemplation."
34,00:11:36.000,00:13:00.760,"This video clip presents a tense and atmospheric scene set inside a moving car during what appears to be sunset or sunrise, judging by the warm, golden light filtering through the windows. The camera is positioned from the back of the car, looking forward, capturing four men in a confined space.

The scene is characterized by a dynamic interplay of emotions and roles among the men:

- **The Driver (Right Front Seat):** A man in a dark suit and tie, focused intently on the road ahead. His expression is serious and alert, suggesting he is in control of a potentially dangerous situation. His posture and grip on the wheel convey a sense of responsibility and caution.

- **The Passenger (Left Front Seat):** A younger man, also dressed formally in a shirt and tie with suspenders, sits with a look of concern or apprehension. He is looking down or away, appearing anxious or perhaps overwhelmed by the situation unfolding around him.

- **The Backseat Passengers (Middle and Right):** Two older men with beards occupy the backseat. The man on the left, wearing a cap and a plaid shirt under a vest, is animated and expressive. He is actively talking, gesturing with his hands, and appears to be the center of a heated conversation. His demeanor suggests he is passionate, possibly angry, or trying to make a compelling point. The man beside him, also in a suit, listens intently, his expression serious and focused, indicating he is deeply engaged in the discussion.

The overall atmosphere is one of high tension and urgency. The confined space of the car, combined with the intense expressions and gestures of the men, suggests a critical conversation or confrontation is taking place. The warm, golden light adds a layer of drama and intensity, casting long shadows and highlighting the men's faces with a cinematic quality.

The scene feels like a pivotal moment in a larger narrative, perhaps a heist, a mission, or a clandestine meeting. The formal attire of the men contrasts with the informal, almost chaotic energy of the conversation, creating a sense of underlying conflict or impending action. The camera's fixed position from the back of the car adds to the feeling of being an observer caught in the middle of a high-stakes situation."
