scene_id,start_time,end_time,description
15,00:02:41.960,00:02:44.880,"The video sequence presents a cinematic, introspective moment centered on a man driving a car through a barren, desert-like landscape.

The scene opens with a clear, medium shot of the man, who is dressed in a dark suit and tie. He is seated in the driver's seat, his head tilted slightly, eyes closed or looking down, conveying a sense of weariness, contemplation, or deep thought. His hand rests on the steering wheel, and a watch is visible on his wrist. The car's interior is well-appointed with light-colored leather seats, and the view through the window reveals a vast, empty, sandy expanse under a pale sky, emphasizing his solitude.

The camera then employs a deliberate, artistic technique: it begins to blur, obscuring the man and the car with a soft, out-of-focus haze. This transition is not a technical error but a stylistic choice, perhaps suggesting a shift in perspective, the passage of time, or a lapse into memory or dream. The blur is a dominant visual element, filling the frame with indistinct shapes and muted tones of blue and grey.

As the blur gradually resolves, the camera refocuses on the man. The shot composition is now different; a large, out-of-focus element—possibly the shoulder or back of another person, or a piece of fabric—occupies the foreground, partially obscuring the view of the driver. This creates a sense of voyeurism or a barrier between the viewer and the subject, adding to the scene's emotional weight. The man remains in the same state of quiet introspection, his expression unchanged.

In essence, the video uses visual storytelling to convey a mood of isolation and internal struggle. The progression from a clear, focused shot to a blurred, obscured one and back again, with the introduction of a foreground obstruction, builds a layered narrative of solitude, perhaps even a confrontation with an unseen presence or a personal crisis. The vast, empty landscape outside the car serves as a powerful metaphor for the emptiness or burden the man may be carrying within."
16,00:02:44.920,00:02:51.240,"This video sequence captures a tense, dramatic interaction between two men in a car, filmed from the perspective of the passenger seat.

**Scene Setup:**
The camera is positioned inside a car, looking out the open passenger-side window. The interior is a light beige or tan color. The man in the passenger seat is in sharp focus. He is a man with dark hair, wearing a dark suit, a light blue collared shirt, and a dark tie. He is looking out the window, his expression initially neutral or slightly concerned.

**The Interaction:**
Outside the car, another man is leaning in through the open window. He is dressed in a white dress shirt and a dark tie. He is balding with a mustache. His demeanor is urgent and intense.

*   **Progression:** The sequence shows the man outside moving from a more distant, slightly blurred position (image 1) to leaning forward, pressing his hands against the car door frame (image 2), and then leaning in very close to the passenger (images 3-11).
*   **Expression:** His facial expression is the focal point of the tension. He has a furrowed brow, his mouth is open as if he is speaking urgently or pleading, and his eyes are wide and fixed on the man inside. His posture conveys a sense of desperation or a critical, time-sensitive message.
*   **The Passenger's Reaction:** The man inside the car remains relatively still, looking at the man outside. His expression shifts subtly throughout the sequence. Initially, he appears to be listening intently. As the man outside becomes more animated, the passenger's expression becomes more somber and resigned, suggesting he is absorbing difficult news or a serious situation.

**Overall Mood:**
The video creates a strong sense of suspense and drama. The close framing, the focused expressions, and the physical proximity of the two men suggest a high-stakes conversation. The setting appears to be a rural or roadside location, adding to the feeling of isolation and urgency. The sequence implies a pivotal moment, possibly involving a confrontation, a confession, or a plea for help."
17,00:02:51.280,00:03:01.640,"The video begins with a scene of two cars parked on the side of a rural road, set against a backdrop of rolling hills, agricultural fields, and wind turbines under a clear blue sky. The first car is a dark-colored BMW sedan, and the second is a silver sedan parked just behind it. Several men are gathered around the vehicles.

In the initial frames, a man in a white shirt is leaning into the driver's side window of the BMW, appearing to speak with the driver who is seated inside. Another man, dressed in a dark suit, is standing near the BMW's front passenger door, which is open. In the background, two other men are standing near the silver sedan.

As the sequence progresses, the man in the suit steps out of the BMW, closing the door behind him. He then stands beside the car, facing the man in the white shirt, and they appear to engage in a conversation. The man in the white shirt gestures with his hand as he speaks, while the man in the suit listens attentively. Their interaction suggests a discussion or exchange of information.

The scene then transitions to a wide, static shot of the same rural road, now empty of people. The camera captures the expansive landscape, featuring fields of sunflowers and dry grass, with the road curving gently into the distance. The sky remains clear and blue, emphasizing the serene and isolated nature of the location. This final shot provides a sense of calm and solitude, contrasting with the earlier interaction between the men.

Overall, the video captures a moment of human interaction in a rural setting, followed by a tranquil, empty landscape, highlighting the contrast between human activity and the natural environment."
18,00:03:01.680,00:03:16.040,"This video presents a cinematic, slow-motion sequence set on a quiet, rural road during what appears to be the golden hour, with warm sunlight bathing the scene. The setting is a picturesque, rolling countryside, characterized by golden-brown fields, distant wind turbines, and a clear, expansive blue sky.

The central focus is a group of men dressed in formal attire, including suits and ties, gathered around two parked cars. The most prominent vehicle is a sleek, black BMW sedan with the license plate ""91 MLN 513"". A second, silver sedan is parked beside it.

The narrative unfolds through a series of subtle, deliberate movements:

1.  **Initial Gathering:** The video opens with a man in a dark suit standing by the BMW, appearing to be in conversation with a man in a white shirt who is leaning against the car. In the background, two other men are visible near the silver car.
2.  **Arrival and Interaction:** A third man, dressed in a grey suit, enters the scene from the right side of the frame. He walks towards the group, gesturing with his hand as if to join the conversation or draw attention to something.
3.  **Converging Group:** The man in the grey suit stops and begins to interact with the others. He then bends down, seemingly to inspect something on the ground near the front of the black BMW. This action draws the attention of the other men, who begin to gather around him.
4.  **Group Discussion:** The group forms a small cluster around the front of the car. The man in the white shirt steps back slightly, while the man in the dark suit and the man in the grey suit (now standing) engage in what appears to be a serious discussion. The man in the grey suit remains bent over, focused on the ground, while the others look on.

The overall atmosphere is one of quiet intensity and focused discussion, suggesting a planned meeting or a significant event. The rural setting and the formal attire of the men create a sense of intrigue, hinting at a narrative that is both sophisticated and potentially suspenseful. The video's slow-motion style enhances the dramatic tension, allowing the viewer to absorb every subtle gesture and expression."
19,00:03:16.080,00:03:27.360,"Based on the provided video frames, here is a detailed description of the scene:

The video depicts an outdoor business meeting or discussion taking place in a field during what appears to be late afternoon or early evening, judging by the warm, golden light. The setting is open and natural, with a blurred background of greenery and a clear, light-blue sky.

The central figure is a young man with dark hair and a mustache, wearing a grey suit jacket over a light blue collared shirt. He is wearing white wireless earbuds and is holding a smartphone in a light-colored case tucked into his jacket pocket. His facial expressions and gestures indicate he is actively speaking and explaining something with conviction. He uses hand gestures for emphasis, including raising his fist in a moment of passion or assertion.

He is surrounded by three other men, who are listening to him. Their appearances and attire suggest a professional context:
- To his left (viewer's right), an older man with grey hair and a dark suit is partially visible.
- To his right (viewer's left), a younger man in a dark suit is seen from the back.
- In later frames, a fourth man, wearing a white shirt and dark tie, becomes more prominent, speaking and gesturing as if he is now taking the lead in the conversation.

The camera maintains a relatively steady, medium shot, focusing on the central speaker and capturing the dynamic interaction between the group. The overall mood is one of serious, focused discussion, possibly involving negotiation or a presentation. The natural lighting and open field setting contrast with the formal attire, creating a unique, perhaps informal, business environment."
20,00:03:27.400,00:03:44.840,"This video sequence captures a dynamic and cinematic scene unfolding on a rural road at sunset.

**Setting and Atmosphere:**
The scene is set on a two-lane asphalt road flanked by a field of tall sunflowers and dry, golden grasses. The warm, golden light of the setting sun bathes the landscape, creating a serene yet slightly dramatic atmosphere. The road stretches into the distance, emphasizing a sense of isolation and journey.

**Main Action:**
The central focus is a black BMW sedan, which appears to be a model from the 5 Series. The sequence begins with a group of men gathered around the car. Initially, they seem to be helping someone out of the vehicle. The car's doors are opened, and several men, dressed in suits and formal attire, assist a man in a white shirt and tie as he exits the car. One man in a grey suit is particularly active in helping him.

**Character Dynamics:**
The group consists of several men, some in suits and others in more casual attire. One man, dressed in a light-colored shirt and dark pants, appears to be the one being helped out of the car. Another man, wearing a beige vest and carrying a bag, stands nearby, observing the scene. The men in suits seem to be bodyguards or assistants, ensuring the man's safe exit.

**Progression:**
As the sequence progresses, the man being helped exits the car and begins to walk away, accompanied by the men in suits. The man in the beige vest follows them, and the group moves along the road, away from the car. The scene ends with the car's doors still open, and the group continuing their journey down the road.

**Overall Impression:**
The video conveys a sense of urgency and importance, as if the man being helped is someone of significance. The setting and the actions of the characters suggest a high-stakes situation, possibly a clandestine meeting or an escape. The warm, golden light adds a layer of drama and tension to the scene, making it visually striking and emotionally engaging."
21,00:03:44.880,00:05:24.440,"This video clip presents a continuous, cinematic shot from the perspective of a passenger in the front seat of a car, looking forward. The scene is set during sunset or sunrise, with the sun positioned directly ahead of the vehicle, creating a strong lens flare that bathes the interior in a warm, golden light.

The car is occupied by two men. The driver, seated on the right, is wearing a light-colored, possibly white, collared shirt and has a mustache. He is focused on the road, with his hands on the steering wheel. The passenger in the front seat, on the left, is dressed in a dark suit jacket over a light blue shirt and also has a mustache. He is wearing white earbuds and appears to be looking down, possibly at a device on the dashboard or his lap, suggesting he might be listening to music or a podcast.

The car is traveling on a road through a flat, open landscape, likely rural or semi-desert. The scenery outside the windows is sparse, with dry grass or fields visible. As the car moves, the background scenery shifts, and at times, utility poles or power lines can be seen passing by on the roadside.

Throughout the video, the passenger in the front seat occasionally looks up, turns his head to glance at the driver, or adjusts his position. The driver remains mostly focused on the road, with minimal movement, indicating a calm and steady drive. The overall atmosphere is quiet and contemplative, with the golden hour lighting adding a serene and slightly melancholic tone to the scene.

The video's composition and lighting suggest it could be from a film or a high-quality short video, emphasizing mood and atmosphere over action. The consistent camera angle and the lack of abrupt movements create a sense of stillness and introspection, inviting the viewer to observe the subtle interactions and expressions of the two men as they travel together."
22,00:05:24.480,00:06:05.040,"This video presents a serene, wide-angle view of a rural landscape under a vast, blue sky dotted with fluffy white clouds. The scene is dominated by a field of dry, golden-brown grass and harvested crops, stretching out towards a distant, rolling horizon. Several wind turbines are scattered across the landscape, their tall, slender towers and three-bladed rotors standing out against the sky, suggesting a focus on renewable energy.

The video begins with a static shot of this tranquil scenery. The camera remains fixed, allowing the viewer to absorb the peaceful, open environment. The wind turbines are stationary, and the clouds drift slowly across the sky, adding a sense of calm and timelessness.

The scene then transitions as a dark-colored car enters the frame from the left side, driving along a paved road that runs horizontally across the lower portion of the image. The car moves steadily from left to right, its motion contrasting with the stillness of the landscape.

As the car continues its journey, a second car, also dark-colored, appears from the left side of the frame, following the first car. The two vehicles drive side by side for a moment before the first car continues on its path, leaving the second car behind.

The video concludes with the two cars driving away into the distance, their forms gradually becoming smaller as they recede into the horizon. The wind turbines remain a constant presence, their silhouettes standing tall against the sky, while the fields and sky continue to exude a sense of peace and tranquility.

Overall, the video captures a moment of quiet rural life, with the wind turbines symbolizing progress and sustainability, set against the timeless beauty of nature. The movement of the cars adds a subtle narrative element, suggesting human activity within this expansive, peaceful setting."
23,00:06:05.080,00:06:10.640,"Based on the provided sequence of images, here is a description of the video:

The video depicts a tense and serious conversation between four men in a vast, open field under a bright, partly cloudy sky. A wind turbine is visible in the background, suggesting a rural or semi-industrial setting.

The central figure is a bald man with a graying beard, dressed in a black suit, white shirt, and black tie. He stands with his hands on his hips, adopting a posture that conveys authority, impatience, or frustration as he speaks to the others. His facial expression is stern and animated, indicating he is the focal point of the discussion.

The other three men are dressed in business attire, including suits and ties. Their body language and expressions suggest they are listening intently, though one man (on the far left, wearing a light blue shirt and suspenders) is actively engaged, gesturing with his hand as if making a point or arguing. The man in the center-left is wearing a dark suit with a vest and has sunglasses tucked into his jacket pocket. The man on the right is also in a light blue shirt and tie, listening closely.

The camera slowly pans or zooms out to reveal all four men in the frame, emphasizing the group dynamic. The overall atmosphere is one of high-stakes negotiation or confrontation, set against a stark, natural backdrop. The contrast between the formal business attire and the rural environment adds to the sense of an unusual or critical meeting."
24,00:06:10.680,00:06:19.080,"This video clip captures a tense, outdoor confrontation between five men. The setting is a bright, open space under a clear, pale blue sky, with a hint of greenery in the distant background.

The group is arranged in a loose circle, suggesting a serious discussion or disagreement. Their body language and facial expressions convey a high level of tension and focus.

- **The Man in the White Shirt (Left):** He is actively speaking and gesturing, leaning forward with an open hand. His expression is serious and insistent, indicating he is making a strong point or argument.
- **The Man in the Light Blue Shirt (Center-Left):** He stands with a rigid posture, his brow furrowed and his gaze fixed on the man speaking. His expression is one of deep concern, skepticism, or perhaps frustration.
- **The Man in the Orange T-Shirt and Vest (Center):** He wears glasses and has a beard. He is listening intently, his expression serious and thoughtful. He appears to be absorbing the information being presented, possibly weighing his options or preparing to respond.
- **The Bald Man in the Suit (Right):** He is turned towards the speaker, listening with a stern, focused expression. His presence adds to the gravity of the situation.
- **The Man in the Suit (Far Right):** He is partially obscured but is also engaged in the conversation, his expression serious and attentive.

The camera remains relatively static, focusing on the group's interaction. The lighting is natural and even, highlighting the intensity of the moment. The overall mood is one of high stakes, with the men clearly involved in a significant and potentially volatile exchange."
25,00:06:19.120,00:06:29.200,"This video clip depicts a tense, serious conversation between four men in a stark, outdoor setting.

**Scene Setting:**
The scene takes place in a vast, open, and arid landscape under a bright, partly cloudy sky. In the distant background, the faint silhouette of a wind turbine is visible, suggesting a remote, possibly industrial or rural location.

**The Characters:**
There are four men, all dressed in formal business attire, which contrasts sharply with the barren environment.
- **Man 1 (Center, speaking):** A bald man with a graying beard, wearing a black suit jacket over a white shirt and black tie. He is the apparent leader of the group, standing with his hands on his hips, and is actively speaking with a stern, intense expression. His body language and facial expressions convey authority and urgency.
- **Man 2 (Left of center, listening):** A younger man with dark hair, dressed in a dark pinstripe three-piece suit with a white shirt and black tie. He has a watch on his left wrist and sunglasses tucked into his jacket pocket. He stands with his hands clasped in front of him, listening intently to the speaker, his expression serious and focused.
- **Man 3 (Right of center, listening):** A man with dark hair and a mustache, wearing a light blue shirt and black tie. He is positioned to the right of the speaker and is also listening, his gaze fixed on the man speaking.
- **Man 4 (Far left, partially seen):** A man in a light blue shirt with suspenders, seen mostly from the back and side. He is part of the group but less central to the immediate interaction.

**Action and Dynamics:**
The core of the video is the conversation. The bald man in the center is the primary speaker, his mouth moving as he delivers his message. The other three men are attentive listeners, their postures and gazes directed towards him. The interaction is clearly formal and serious, suggesting a discussion of significant importance, perhaps involving business, politics, or a critical decision. The slight shifts in their expressions and head positions across the frames indicate an evolving, dynamic conversation.

Overall, the video conveys a sense of gravity and importance, with the formal attire and the desolate setting creating a stark, almost cinematic atmosphere. The focus is on the interpersonal dynamics and the weight of the conversation taking place."
26,00:06:29.240,00:06:35.280,"This video sequence captures a tense, interpersonal confrontation between five men in an outdoor setting.

**Setting & Atmosphere:**
The scene takes place outdoors under a clear, bright blue sky. The background is a field of what appears to be sunflowers or tall yellow wildflowers, suggesting a rural or semi-rural location. A dark-colored car is visible behind the group, adding to the sense of a staged or significant meeting.

**The Characters:**
There are five men present, arranged in a loose circle.
*   **Man in the center (light blue shirt, suspenders):** He is the central focus of the interaction. He has a beard and mustache and maintains a serious, skeptical, or even angry expression throughout the sequence. His body language is rigid, and he appears to be the one being confronted or is holding his ground.
*   **Man with glasses (orange t-shirt, vest):** He is positioned directly across from the man in suspenders. He is the most expressive, starting with a serious look, then smiling or smirking, and finally looking down in defeat or resignation as the scene progresses. His demeanor suggests he is the one initiating or leading the confrontation.
*   **Man in the foreground (left side, white shirt):** He is partially turned away, observing the interaction between the other two.
*   **Man in the foreground (right side, dark suit):** He is an older man with gray hair and a beard, wearing a dark suit. He is also observing the central conflict.
*   **Man in the background (right side, dark suit):** He stands behind the older man, also watching the scene unfold.

**The Action & Narrative:**
The sequence shows a dynamic conversation or argument.
1.  **Initial Confrontation (Frames 1-5):** The man in the blue shirt and suspenders is initially looking down, appearing troubled or defiant. The man with glasses looks at him, and their expressions shift from serious to a slight, perhaps sarcastic, smile. The man in suspenders then looks up at him, his expression hardening.
2.  **Escalation & Defeat (Frame 6-12):** The man with glasses begins to turn away, his head bowing in defeat or submission. The man in suspenders continues to look at him, his expression unchanged. The camera slowly pans to the right, keeping the man in suspenders in view as the other men turn away, effectively removing the man with glasses from the frame. The scene ends with the man in suspenders standing alone, facing the others who are now looking down or away, suggesting his victory or the end of the confrontation.

Overall, the video portrays a moment of high tension and emotional conflict, culminating in a clear shift in power or a resolution where one man (in suspenders) stands firm while the other (with glasses) retreats. The camera work, with its slow pan, emphasizes the isolation of the man in suspenders and the group's collective withdrawal."
